id,title,author,date,categories,url
20231103113612164,"Ông bầu Hoàng Tuấn dự định rút đơn kiện, quản lý Dương Edward tuyên bố sẵn sàng gặp nhau tại tòa!","Minh Khôi,",2023-11-03T11:46:00,"Musik, Việt Nam",https://kenh14.vn/ong-bau-hoang-tuan-du-dinh-rut-don-kien-quan-ly-duong-edward-tuyen-bo-san-sang-gap-nhau-tai-toa-20231103113612164.chn
20231103113102163,Sức hút của Maroon 5: Toàn bộ vé mở bán sớm của 8Wonder Winter Festival đều đã hết sạch!,"Minh Khôi,",2023-11-03T11:33:00,"Musik, Việt Nam",https://kenh14.vn/suc-hut-cua-maroon-5-toan-bo-ve-mo-ban-som-cua-8wonder-winter-festival-deu-da-het-sach-20231103113102163.chn
20231103104858538,Cổng âm nhạc đa giác quan GENfest tung trailer trước giờ G điểm lại line-up tỷ view với những cái tên siêu hot,"Quang Vũ,",2023-11-03T11:02:00,"Musik, Việt Nam",https://kenh14.vn/cong-am-nhac-da-giac-quan-genfest-tung-trailer-truoc-gio-g-diem-lai-line-up-ty-view-voi-nhung-cai-ten-sieu-hot-20231103104858538.chn
20231102214417994,"Phim của Suzy hé lộ 3 khoảnh khắc ám ảnh các idol Kpop: Jung Kook phải ngậm núm vú giả, aespa bị nhân viên quay lén","Tuyết Hiền,",2023-11-03T11:00:00,"Musik, Châu Á",https://kenh14.vn/phim-cua-suzy-he-lo-3-khoanh-khac-am-anh-cac-idol-kpop-jung-kook-phai-ngam-num-vu-gia-aespa-bi-nhan-vien-quay-len-20231102214417994.chn
20231102194745939,"Bang Sihyuk bất chấp khoản nợ 10 tỷ won cho ra mắt BTS, gọi khoảnh khắc tái ký là ""hạnh phúc nhất"" sự nghiệp!","Tuyết Hiền,",2023-11-03T09:25:00,"Musik, Châu Á",https://kenh14.vn/bang-sihyuk-bat-chap-khoan-no-10-ty-won-cho-ra-mat-bts-goi-khoanh-khac-tai-ky-la-hanh-phuc-nhat-su-nghiep-20231102194745939.chn
20231030231041569,Chuyện gì đang xảy ra giữa Noo Phước Thịnh và NS Đỗ Hiếu?,"An Nhi,",2023-10-31T08:00:00,"Musik, Việt Nam",https://kenh14.vn/chuyen-gi-dang-xay-ra-giua-noo-phuoc-thinh-va-ns-do-hieu-20231030231041569.chn
20231027023723807,Chính thức xác nhận: Maroon 5 sẽ biểu diễn tại Phú Quốc vào tháng 12!,"Minh Khôi,",2023-10-26T23:55:00,"Musik, Việt Nam",https://kenh14.vn/chinh-thuc-xac-nhan-maroon-5-se-bieu-dien-tai-phu-quoc-vao-thang-12-20231027023723807.chn
20210724074615855,"BLACKPINK vượt Maroon 5 để trở thành nhóm nhạc có kênh YouTube đạt nhiều lượt xem nhất, đến BTS chạy dài mới theo kịp","KIKI,",2021-07-24T08:30:38,"Musik, Châu Á",https://kenh14.vn/blackpink-vuot-maroon-5-de-tro-thanh-nhom-nhac-co-kenh-youtube-dat-nhieu-luot-xem-nhat-den-bts-chay-dai-moi-theo-kip-20210724074615855.chn
20201218171514073,,,,,https://kenh14.vn/trinh-thang-binh-cong-khai-2-ban-nhac-so-sanh-truong-hop-giua-bigbang-va-maroon-5-de-phan-phao-nghi-van-dao-hit-jay-chou-20201218171514073.chn
20231030173611287,"""Tình đầu quốc dân"" và phong độ nhan sắc không đổi, visual thời thực tập sinh thế nào mà gây sốt MXH Hàn?","Tuyết Hiền,",2023-10-30T19:00:00,"Musik, Châu Á",https://kenh14.vn/tinh-dau-quoc-dan-va-phong-do-nhan-sac-khong-doi-visual-thoi-thuc-tap-sinh-the-nao-ma-gay-sot-mxh-han-20231030173611287.chn
20231028144319423,"Dân mạng Hàn nghi ngờ YG sao chép NewJeans cho nhóm nhạc nữ mới, thực hư thế nào?","Tuyết Hiền,",2023-10-28T14:52:00,"Musik, Châu Á",https://kenh14.vn/dan-mang-han-nghi-ngo-yg-sao-chep-newjeans-cho-nhom-nhac-nu-moi-thuc-hu-the-nao-20231028144319423.chn
20231020170711382,"Dung mạo 10 năm trước so với hiện tại của loạt Chị Đẹp Đạp Gió: Ai xứng danh ""nữ hoàng không tuổi""?","Nguyễn Quỳnh Trang,",2023-10-20T21:00:00,"Đời sống, Đời sống",https://kenh14.vn/dung-mao-10-nam-truoc-so-voi-hien-tai-cua-loat-chi-dep-dap-gio-ai-xung-danh-nu-hoang-khong-tuoi-20231020170711382.chn
20230929184942189,"MC Hoàng Oanh đăng ảnh hội Đạp Gió đi ăn xả hơi đúng Trung thu, vô tình lộ mặt mộc của các “chị đẹp”","Nguyễn Quỳnh Trang,",2023-09-29T20:10:00,"Đời sống, Đời sống",https://kenh14.vn/mc-hoang-oanh-dang-anh-hoi-dap-gio-di-an-xa-hoi-dung-trung-thu-vo-tinh-lo-mat-moc-cua-cac-chi-dep-20230929184942189.chn
20231019170732438,Nhan sắc Huyền Baby giữa dàn sao khủng sự kiện “Đạp Gió”: Cam thường vẫn đẹp từng milimét,"S.A,",2023-10-19T17:08:00,"Đời sống, Đời sống",https://kenh14.vn/nhan-sac-huyen-baby-giua-dan-sao-khung-su-kien-dap-gio-cam-thuong-van-dep-tung-milimet-20231019170732438.chn
20231019155641188,Cận cảnh chiếc cổng cưới 2 con rồng khủng trong đám hỏi Hà Trí Quang và Thanh Đoàn: Chi phí đầu tư gây tò mò,"Hải My,",2023-10-19T15:57:04,"Đời sống, Đời sống",https://kenh14.vn/can-canh-chiec-cong-cuoi-2-con-rong-khung-trong-dam-hoi-ha-tri-quang-va-thanh-doan-chi-phi-dau-tu-gay-to-mo-20231019155641188.chn
20231014131801227,"Mê cái cách mà Lâm Bảo Châu “flex” sự cưng chiều dành cho Lệ Quyên, nói gì mà netizen cũng luỵ theo?","Hải My,",2023-10-14T13:25:32,"Đời sống, Đời sống",https://kenh14.vn/me-cai-cach-ma-lam-bao-chau-flexsu-cung-chieu-danh-cho-le-quyen-noi-gi-ma-netizen-cung-luy-theo-20231014131801227.chn
20230906202956449,"Chồng đại gia của Lan Khuê lọt ống kính “team qua đường”, chỗ ngồi khi xem show của vợ gây tranh cãi?","Hải My,",2023-09-06T22:00:50,"Đời sống, Đời sống",https://kenh14.vn/chong-dai-gia-cua-lan-khue-lot-ong-kinh-team-qua-duong-cho-ngoi-khi-xem-show-cua-vo-gay-tranh-cai-20230906202956449.chn
20230825082129461,"Xu hướng mừng cưới không tiền mặt: Dâu rể nhàn tênh, khách mời thích thú vì sự tiện lợi","S.A,",2023-08-25T09:27:00,"Đời sống, Đời sống",https://kenh14.vn/xu-huong-mung-cuoi-khong-tien-mat-dau-re-nhan-tenh-khach-moi-thich-thu-vi-su-tien-loi-20230825082129461.chn
20230717085007339,Ngôi nhà đẹp như cổ tích trên đồi ở Lâm Đồng khiến ai cũng muốn bỏ phố về quê,"Nhật Thuỳ/ VTC News,",2023-07-17T11:36:00,"Đời sống, Đời sống",https://kenh14.vn/ngoi-nha-dep-nhu-co-tich-tren-doi-o-lam-dong-khien-ai-cung-muon-bo-pho-ve-que-20230717085007339.chn
20230703124330758,"Chàng trai 9x bỏ phố về quê trồng sen, đếm hoa thu tiền","Thu Hiền,",2023-07-03T13:46:00,"Đời sống, Đời sống",https://kenh14.vn/chang-trai-9x-bo-pho-ve-que-trong-sen-dem-hoa-thu-tien-20230703124330758.chn
20230904195948893,"Bùi Khánh Linh ở phố chuẩn dáng Á hậu, về quê để mặt mộc xắn tay áo rửa bát như ai","HẢI MY,",2023-09-04T20:31:00,"Đời sống, Đời sống",https://kenh14.vn/bui-khanh-linh-o-pho-chuan-dang-a-hau-ve-que-de-mat-moc-xan-tay-ao-rua-bat-nhu-ai-20230904195948893.chn
20230601095812706,"Rời khói bụi thành phố cùng áp lực KPI, vợ chồng 9x quyết định đưa các con về quê sinh sống","Thảo Hương,",2023-06-01T10:03:00,"Đời sống, Đời sống",https://kenh14.vn/roi-khoi-bui-thanh-pho-cung-ap-luc-kpi-vo-chong-9x-quyet-dinh-dua-cac-con-ve-que-sinh-song-20230601095812706.chn
20230601000536028,"Loạt mâm cơm dân dã miền Tây khiến người xem ấp ủ giấc mơ ""bao giờ giàu về quê sống""","Hải My,",2023-06-01T08:00:00,"Đời sống, Đời sống",https://kenh14.vn/loat-mam-com-dan-da-mien-tay-khien-nguoi-xem-ap-u-giac-mo-bao-gio-giau-ve-que-song-20230601000536028.chn
20230529065147942,"Cô gái sinh năm 1999 về quê làm ruộng dù học xong có việc ngay, mức lương khá","Huyền Trang,",2023-05-29T08:16:00,"Đời sống, Nhân Vật",https://kenh14.vn/co-gai-sinh-nam-1999-ve-que-lam-ruong-du-hoc-xong-co-viec-ngay-muc-luong-kha-20230529065147942.chn
20230623072313891,"10 năm thuê nhà ở phố, gom tiền về quê mua đất xây tổ ấm đẹp như mơ","Huyền Trang - Ảnh: NVCC - Thiết kế: Thành Đạt,",2023-06-23T07:30:00,"Đời sống, Nhân Vật",https://kenh14.vn/10-nam-thue-nha-o-pho-gom-tien-ve-que-mua-dat-xay-to-am-dep-nhu-mo-20230623072313891.chn
20230524191532787,"Cách sống thông minh, hạnh phúc: Bớt lo chuyện người ta, ít nói lời tầm phào","Trung Hạ,",2023-05-25T06:17:38,"Đời sống, Đời sống",https://kenh14.vn/cach-song-thong-minh-hanh-phuc-bot-lo-chuyen-nguoi-ta-it-noi-loi-tam-phao-20230524191532787.chn
20230523080320442,"""Thôn nữ"" sinh năm 2003 làm người xa quê xao xuyến với loạt cơm nhà đậm chất tuổi thơ","Vân Anh,",2023-05-23T08:06:00,"Đời sống, Nhân Vật",https://kenh14.vn/thon-nu-sinh-nam-2003-lam-nguoi-xa-que-xao-xuyen-voi-loat-com-nha-dam-chat-tuoi-tho-20230523080320442.chn
20230520064802288,"Cô gái bỏ phố về quê nấu cơm tấm, trà sữa đãi tụi nhỏ trong buôn","Hải My,",2023-05-20T07:00:58,"Đời sống, Đời sống",https://kenh14.vn/co-gai-bo-pho-ve-que-nau-com-tam-tra-sua-dai-tui-nho-trong-buon-20230520064802288.chn
20230524011351891,"Bán nhà phố về quê mua đất hoang trồng cây trái: “Thấy mình già nhanh, đen nhẻm nhưng xứng đáng”","Huyền Trang - Ảnh: NVCC,",2023-05-24T07:00:00,"Đời sống, Nhân Vật",https://kenh14.vn/ban-nha-pho-ve-que-mua-dat-hoang-trong-cay-trai-thay-minh-gia-nhanh-den-nhem-nhung-xung-dang-20230524011351891.chn
20230619110024185,Primmy Trương thay đổi thế nào sau hơn 2 năm cưới Phan Thành?,"S.A,",2023-06-19T11:02:00,"Đời sống, Đời sống",https://kenh14.vn/primmy-truong-thay-doi-the-nao-sau-hon-2-nam-cuoi-phan-thanh-20230619110024185.chn
20230308132819343,Primmy Trương khoe ảnh cùng chồng vi vu ở Mỹ,"SA,",2023-03-08T19:21:00,"Đời sống, Đời sống",https://kenh14.vn/primmy-truong-khoe-anh-cung-chong-vi-vu-o-my-20230308132819343.chn
20230115221816591,Primmy Trương khoe vẻ mặn mà sau sinh,"Hải My,",2023-01-16T07:20:00,"Đời sống, Đời sống",https://kenh14.vn/primmy-truong-khoe-nhan-sac-man-ma-20230115221816591.chn
20230912184711248,"Thành viên team Lan Khuê nói gì về nhận xét thí sinh The New Mentor “chụp hình không nên hồn, ăn nói cũng không xong”?","Hải My,",2023-09-12T21:00:00,"Đời sống, Đời sống",https://kenh14.vn/thanh-vien-team-lan-khue-noi-gi-ve-nhan-xet-thi-sinh-the-new-mentor-chup-hinh-khong-nen-hon-an-noi-cung-khong-xong-20230912184711248.chn
20230909082739637,"Cô gái khiến Hương Giang bất bình, nhấn mạnh 3 lần về sự ""sang trọng"" tại The New Mentor tập 5","S.A,",2023-09-09T09:00:00,"Đời sống, Đời sống",https://kenh14.vn/co-gai-khien-huong-giang-bat-binh-nhan-manh-3-lan-ve-su-sang-trong-tai-the-new-mentor-tap-5-20230909082739637.chn
20230904222931346,"Cặp ""nữ hoàng lookbook"" thi The New Mentor","Nguyễn Quỳnh Trang,",2023-09-05T00:00:00,"Đời sống, Đời sống",https://kenh14.vn/cap-nu-hoang-lookbook-thi-the-new-mentor-20230904222931346.chn
20230909133304327,Biểu cảm “chết đứng” của hội thí sinh khi Hà Hồ hỏi nghĩ sao về màn loại người gây sóng gió của Hương Giang,"S.A,",2023-09-09T14:33:16,"Đời sống, Đời sống",https://kenh14.vn/bieu-cam-chet-dung-cua-hoi-thi-sinh-khi-ha-ho-hoi-nghi-sao-ve-man-loai-nguoi-gay-song-gio-cua-huong-giang-20230909133304327.chn
20230802113117245,"Cici Anh Chi - ""thành viên thứ 5” của BLACKPINK lộ cảnh đời thường bị mẹ sai vặt","SA,",2023-08-02T11:31:00,"Đời sống, Đời sống",https://kenh14.vn/cici-anh-chi-thanh-vien-thu-5-cua-blackpink-lo-canh-doi-thuong-bi-me-sai-vat-20230802113117245.chn
20230731082558694,Cici Anh Chi - “Thành viên thứ 5” của BLACKPINK phụng phịu muốn khóc khi concert kết thúc,"Hải My,",2023-07-31T08:29:00,"Đời sống, Đời sống",https://kenh14.vn/cici-anh-chi-thanh-vien-thu-5-cua-blackpink-phung-phiu-muon-khoc-khi-concert-ket-thuc-20230731082558694.chn
20230710095632338,Producer Wokeup đẹp trai cỡ nào mà được “hot girl Tây Hồ” Cici chấm 10 điểm?,"SA,",2023-07-10T10:12:00,"Đời sống, Đời sống",https://kenh14.vn/producer-wokeup-dep-trai-co-nao-ma-duoc-hot-girl-tay-ho-cici-cham-10-diem-20230710095632338.chn
20230830071014223,"Kiếm 20 triệu trong 3 ngày lễ, “người cá dẫn tour” đảo Phú Quý đắt sô","Nguyễn Quỳnh Trang,",2023-08-30T08:00:00,"Đời sống, Đời sống",https://kenh14.vn/kiem-20-trieu-trong-3-ngay-le-nguoi-ca-dan-tour-dao-phu-quy-dat-so-20230830071014223.chn
20230828074154749,Á hậu Hồng Hạnh được Mai Ngô dặn gì trong hậu trường trước khi có màn ứng xử đảo ngược tình thế?,"S.A,",2023-08-28T08:18:00,"Đời sống, Đời sống",https://kenh14.vn/a-hau-hong-hanh-duoc-mai-ngo-dan-gi-trong-hau-truong-truoc-khi-co-man-ung-xu-dao-nguoc-tinh-the-20230828074154749.chn
20230907191643182,"Tay trắng về đảo Phú Quý xây homestay: Toát mồ hôi với kinh phí lên tới 2 tỷ, cái kết ra sao?","Nguyễn Quỳnh Trang - Ảnh NVCC - Thiết kế: Huyền Trang,",2023-09-08T00:00:00,"Đời sống, Nhân Vật",https://kenh14.vn/tay-trang-ve-dao-phu-quy-xay-homestay-toat-mo-hoi-voi-kinh-phi-len-toi-2-ty-cai-ket-ra-sao-20230907191643182.chn
20231017093241441,MC Thanh Thanh Huyền gây tranh cãi khi đặt câu hỏi kém duyên cho NTK Đỗ Long về con trai Hồ Ngọc Hà,"Thế Huân,",2023-10-17T09:33:02,"Đời sống, Đời sống",https://kenh14.vn/mc-thanh-thanh-huyen-gay-tranh-cai-khi-dat-cau-hoi-kem-duyen-cho-ntk-do-long-ve-con-trai-ho-ngoc-ha-20231017093241441.chn
20230824114510717,Lý do Thanh Thanh Huyền liên tục lấy tay che mặt khi đi cổ vũ Miss Grand Vietnam 2023?,"Nguyễn Quỳnh Trang,",2023-08-24T11:46:00,"Đời sống, Đời sống",https://kenh14.vn/ly-do-thanh-thanh-huyen-lien-tuc-lay-tay-che-mat-khi-di-co-vu-miss-grand-vietnam-2023-20230824114510717.chn
20230828184627266,"Lê Hoàng Phương - Thanh Thanh Huyền: Bạn thân cùng quê trở thành Hoa hậu, từ học vấn đến sự nghiệp đỉnh ngang nhau","Hải My,",2023-08-28T20:00:00,"Đời sống, Đời sống",https://kenh14.vn/le-hoang-phuong-thanh-thanh-huyen-ban-than-cung-que-tro-thanh-hoa-hau-tu-hoc-van-den-su-nghiep-dinh-ngang-nhau-20230828184627266.chn
20231010074950317,"Chỉ ""thuật"" giấu dây diện, MC Diệp Chi nhân tiện ""flex"" luôn căn nhà sang rộng chẳng kém khách sạn 5 sao","Nguyễn Quỳnh Trang,",2023-10-10T08:00:00,"Đời sống, House n Home",https://kenh14.vn/chi-thuat-giau-day-dien-mc-diep-chi-nhan-tien-flex-luon-can-nha-sang-rong-chang-kem-khach-san-5-sao-20231010074950317.chn
20231005200614223,"Đi thuê nhà, cô gái cải tạo sân thượng cũ thành vườn chill lãng mạn","S.A,",2023-10-06T08:00:00,"Đời sống, Đời sống",https://kenh14.vn/di-thue-nha-co-gai-cai-tao-san-thuong-cu-thanh-vuon-chill-lang-man-20231005200614223.chn
20231003084817731,"NTK nội thất chỉ ra điều quan trọng cho nhà có thú cưng: Chó cần lưu ý về sofa, mèo cầu kỳ hơn thế","Trúc Hà/ Thiết kế: Trường Dương,",2023-10-03T08:58:00,"Đời sống, House n Home",https://kenh14.vn/ntk-noi-that-chi-ra-dieu-quan-trong-cho-nha-co-thu-cung-cho-can-luu-y-ve-sofa-meo-cau-ky-hon-the-20231003084817731.chn
20231023154712531,Lê Hoàng Phương bùng nổ nhan sắc nữ hoàng trên sân khấu bán kết Miss Grand International 2023,"Tiểu Mai,",2023-10-23T20:38:23,"Beauty & Fashion, Star Style",https://kenh14.vn/le-hoang-phuong-bung-no-nhan-sac-nu-hoang-tren-san-khau-ban-ket-miss-grand-international-2023-20231023154712531.chn
20221026135510282,''Nhặt sạn'' Miss Grand International 2022,"Tử Đan,",2022-10-26T15:30:00,"Beauty & Fashion, Star Style",https://kenh14.vn/nhat-san-miss-grand-international-2022-20221026135510282.chn
20231018203035116,Marc Jacobs nhận làn sóng chỉ trích vì cho model ngã cầu thang để quảng cáo túi xách,"Linh An,",2023-10-18T20:31:17,"Beauty & Fashion, Thời trang",https://kenh14.vn/marc-jacobs-nhan-lan-song-chi-trich-vi-cho-model-nga-cau-thang-de-quang-cao-tui-xach-20231018203035116.chn
20230706071613326,"Hằng Túi công khai người yêu mới, chia sẻ lý do ly hôn lần 2","Hải My,",2023-07-06T07:18:00,"Đời sống, Đời sống",https://kenh14.vn/hang-tui-cong-khai-nguoi-yeu-moi-chia-se-ly-do-ly-hon-lan-2-20230706071613326.chn
20230430131550026,"Đại gia Hằng Túi ở tuổi U40: Nhan sắc ""đỉnh chóp"", có bất động sản trải dài khắp ba miền nhưng vắng bóng ông xã","Dương,",2023-04-30T13:38:00,"Đời sống, Đời sống",https://kenh14.vn/dai-gia-hang-tui-o-tuoi-u40-nhan-sac-dinh-chop-co-bat-dong-san-trai-dai-khap-ba-mien-nhung-vang-bong-ong-xa-20230430131550026.chn
20220418112609411,,,,,https://kenh14.vn/hang-tui-tu-co-gai-di-buon-nam-15-tuoi-tro-thanh-ba-trum-kinh-doanh-online-dai-gia-bds-hon-nhan-voi-chong-thu-2-hanh-phuc-bong-vuong-tin-don-ran-nut-20220418112609411.chn
20230706101815354,"Kiếm lời tiền triệu trên mỗi chiếc vé concert BLACKPINK, nghề camp vé liệu có dễ ăn?","S.A,",2023-07-06T11:00:00,"Đời sống, Đời sống",https://kenh14.vn/kiem-loi-tien-trieu-tren-moi-chiec-ve-concert-blackpink-nghe-camp-ve-lieu-co-de-an-20230706101815354.chn
20230706104320825,"Phillip Nguyễn cùng Linh Rin sẽ đón ""tin vui"" vào cuối năm?","Hải My,",2023-07-06T10:45:00,"Đời sống, Đời sống",https://kenh14.vn/phillip-nguyen-cung-linh-rin-se-don-tin-vui-vao-cuoi-nam-20230706104320825.chn
20230706071013202,"Giảm 10kg, hot girl sở hữu thân hình đồng hồ cát được khen ngợi hết lời","Hải My,",2023-07-06T10:00:00,"Đời sống, Đời sống",https://kenh14.vn/giam-10kg-hot-girl-so-huu-than-hinh-dong-ho-cat-duoc-khen-ngoi-het-loi-20230706071013202.chn
20231020165602155,Cô vợ trẻ làm hẳn thơ lục bát tặng chồng nhân ngày 20/10 khiến anh phục sát đất,"AMT,",2023-10-20T16:58:04,"Đời sống, Đời sống",https://kenh14.vn/co-vo-tre-lam-han-tho-luc-bat-tang-chong-nhan-ngay-20-10-khien-anh-phuc-sat-dat-20231020165602155.chn
20231018072447682,"Quà 20/10, vợ tôi đòi quy ra vàng để ""bỏ ống""","Thái Thịnh/ VTC News,",2023-10-18T10:39:21,"Đời sống, Đời sống",https://kenh14.vn/qua-20-10-vo-toi-doi-quy-ra-vang-de-bo-ong-20231018072447682.chn
20231020190121339,"Chị em ái nữ cựu chủ tịch CLB Sài Gòn cùng nhận quà bất ngờ từ chồng, lập tức đòi biết danh tính ""đạo diễn""","Nguyễn Quỳnh Trang,",2023-10-20T19:05:00,"Đời sống, Đời sống",https://kenh14.vn/chi-em-ai-nu-cuu-chu-tich-clb-sai-gon-cung-nhan-qua-bat-ngo-tu-chong-lap-tuc-doi-biet-danh-tinh-dao-dien-20231020190121339.chn
20230908201724993,"MC Thanh Thanh Huyền: Đừng nghĩ đại gia đang lựa chọn người đẹp, người đẹp cũng đang lựa chọn đại gia","HẢO NGÔ - TRÚC HÀ/ ẢNH: VIẾT THANH/ THIẾT KẾ: THÀNH ĐẠT/ CLIP: KINGLIVE,",2023-09-09T00:00:00,"Đời sống, Nhân Vật",https://kenh14.vn/mc-thanh-thanh-huyen-dung-nghi-dai-gia-dang-lua-chon-nguoi-dep-nguoi-dep-cung-dang-lua-chon-dai-gia-20230908201724993.chn
20231018143404733,"Lệ Quyên rủ dàn “chị đẹp” Đạp Gió lên Đà Lạt chơi, tranh thủ thăm biệt thự nghỉ dưỡng đang xây","S.A,",2023-10-18T14:35:00,"Đời sống, Đời sống",https://kenh14.vn/le-quyen-ru-dan-chi-dep-dap-gio-len-da-lat-choi-tranh-thu-tham-biet-thu-nghi-duong-dang-xay-20231018143404733.chn
20231004204701473,"Cận cảnh căn bếp của Huyền Baby, tưởng nhỏ so với biệt thự 100 tỷ nhưng hoá ra có bí mật phía sau","HẢI MY,",2023-10-04T21:30:00,"Đời sống, House n Home",https://kenh14.vn/can-canh-can-bep-cua-huyen-baby-tuong-nho-so-voi-biet-thu-100-ty-nhung-hoa-ra-co-bi-mat-phia-sau-20231004204701473.chn
20231019163138781,"Cầu thủ nổi tiếng cưới ""tiểu thư"": Tặng nhà và xe sang khi vợ nói thích, nể nhất là cách xử lý khi hôn nhân có ""biến""","Nguyễn Quỳnh Trang,",2023-10-20T06:53:00,"Đời sống, Đời sống",https://kenh14.vn/cau-thu-noi-tieng-cuoi-tieu-thu-tang-nha-va-xe-sang-khi-vo-noi-thich-ne-nhat-la-cach-xu-ly-khi-hon-nhan-co-bien-20231019163138781.chn
20231018072131847,"Hot girl khoe bồ cầu thủ ủi đồ và gấp quần áo cho mình, netizen chỉ chú ý đến dàn múi bụng căng đét!","S.A,",2023-10-18T07:39:00,"Đời sống, Đời sống",https://kenh14.vn/hot-girl-khoe-bo-cau-thu-ui-do-va-gap-quan-ao-cho-minh-netizen-chi-chu-y-den-dan-mui-bung-cang-det-20231018072131847.chn
20231028142655019,KTS kiêm Á hậu Lê Hoàng Phương nói gì khi “bà trùm” Kim Dung hỏi vẽ bản thiết kế nhà miễn phí?,"Hải My,",2023-10-28T20:00:00,"Đời sống, Đời sống",https://kenh14.vn/kts-kiem-a-hau-le-hoang-phuong-noi-gi-khi-ba-trum-kim-dung-hoi-ve-ban-thiet-ke-nha-mien-phi-20231028142655019.chn
20231027170040716,"Nhà 9 tầng trong khu “đất vàng” của gia đình Long Chun: Ngập đồ cổ, view ngắm hoàng hôn xịn đét","Hải My,",2023-10-27T21:00:00,"Đời sống, House n Home",https://kenh14.vn/nha-9-tang-trong-khu-dat-vang-cua-gia-dinh-long-chun-ngap-do-co-view-ngam-hoang-hon-xin-det-20231027170040716.chn
20231026164641537,"Yona Cươn bị phản ứng vì mặc trang phục không phù hợp để quảng cáo sữa tăng cân: Chính chủ ""chặn"" bình luận!","Hải My,",2023-10-26T19:11:00,"Đời sống, Đời sống",https://kenh14.vn/yona-cuon-bi-phan-ung-vi-mac-trang-phuc-khong-phu-hop-de-quang-cao-sua-tang-can-chinh-chu-chan-binh-luan-20231026164641537.chn
20231011072513853,"Tạo ra ""nhật ký làm vườn"", cô gái giải tỏa bớt áp lực lúc mang thai, thành quả thu về rất mãn nhãn!","Nguyễn Quỳnh Trang,",2023-10-12T07:35:00,"Đời sống, Đời sống",https://kenh14.vn/tao-ra-nhat-ky-lam-vuon-co-gai-giai-toa-bot-ap-luc-luc-mang-thai-thanh-qua-thu-ve-rat-man-nhan-20231011072513853.chn
20231009225251288,Hội bạn thân rủ nhau thuê đất làm vườn trồng rau củ hữu cơ,"Nguyễn Quỳnh Trang,",2023-10-10T06:59:00,"Đời sống, Đời sống",https://kenh14.vn/hoi-ban-than-ru-nhau-thue-dat-lam-vuon-trong-rau-cu-huu-co-20231009225251288.chn
20231013074135894,Loạt ảnh góc nghiêng của Út Trong Đất Rừng Phương Nam 2023: Netizen mạnh dạn chấm 10 điểm không có nhưng!,"Hải My,",2023-10-13T08:06:00,"Đời sống, Đời sống",https://kenh14.vn/loat-anh-goc-nghieng-cua-ut-trong-dat-rung-phuong-nam-2023-netizen-manh-dan-cham-10-diem-khong-co-nhung-20231013074135894.chn
20231024084432065,"Cầu thủ kinh doanh thời trang: Văn Toàn kiếm tiền tỉ, Văn Hậu được Doãn Hải My hỗ trợ, Công Phượng ""mất tăm"" cả năm","Bảo Bình,",2023-10-24T08:45:33,"Sport, Hậu Trường",https://kenh14.vn/cau-thu-kinh-doanh-thoi-trang-van-toan-kiem-tien-ti-van-hau-duoc-doan-hai-my-ho-tro-cong-phuong-mat-tam-ca-nam-20231024084432065.chn
20231022200623271,Văn Hậu tình tứ bên vợ Doãn Hải My ở sân Hàng Đẫy sau khi đăng ký kết hôn,"Bảo Bình,",2023-10-22T20:08:00,"Sport, Bóng Đá",https://kenh14.vn/van-hau-tinh-tu-ben-vo-doan-hai-my-o-san-hang-day-sau-khi-dang-ky-ket-hon-20231022200623271.chn
20231024222804766,"Doãn Hải My khoe vóc dáng thon gọn, khác với ảnh ""team qua đường"" chụp giữa nghi vấn có tin vui?","Thanh Hà - Ảnh: BB,",2023-10-25T08:00:00,"Sport, Bóng Đá",https://kenh14.vn/doan-hai-my-khoe-voc-dang-thon-gon-khac-voi-anh-team-qua-duong-chup-giua-nghi-van-co-tin-vui-20231024222804766.chn
20231026183020868,Bảng xếp hạng FIFA mới nhất: ĐT Việt Nam gây bất ngờ lớn,"Yến Hoàng,",2023-10-26T18:30:00,"Sport, Bóng Đá",https://kenh14.vn/bang-xep-hang-fifa-moi-nhat-dt-viet-nam-gay-bat-ngo-lon-20231026183020868.chn
20231024112620489,"Hàng loạt ngôi sao tuyển Việt Nam lọt danh sách đề cử Quả bóng vàng 2023 nhưng vắng Văn Quyết, Văn Toàn","Thanh Xuân,",2023-10-24T11:27:00,"Sport, Bóng Đá",https://kenh14.vn/hang-loat-ngoi-sao-tuyen-viet-nam-lot-danh-sach-de-cu-qua-bong-vang-2023-nhung-vang-van-quyet-van-toan-20231024112620489.chn
20231023135616103,Đội tuyển Việt Nam dùng sân Mỹ Đình ở vòng loại World Cup 2026,"Hoài Dương,",2023-10-23T13:56:00,"Sport, Sport",https://kenh14.vn/doi-tuyen-viet-nam-dung-san-my-dinh-o-vong-loai-world-cup-2026-20231023135616103.chn
20231103105335868,HLV Park Hang-seo nói điều xúc động khi HLV Mai Đức Chung chia tay ĐT nữ Việt Nam,"Thanh Xuân,",2023-11-03T10:54:00,"Sport, Bóng Đá",https://kenh14.vn/hlv-park-hang-seo-noi-dieu-xuc-dong-khi-hlv-mai-duc-chung-chia-tay-dt-nu-viet-nam-20231103105335868.chn
20231103104608859,"Messi khệ nệ bê Quả bóng vàng thứ 8 đi ""flex"", phản ứng của cậu quý tử gây chú ý","AB,",2023-11-03T10:46:00,"Sport, Bóng Đá",https://kenh14.vn/messi-khe-ne-be-qua-bong-vang-thu-8-di-flex-phan-ung-cua-cau-quy-tu-gay-chu-y-20231103104608859.chn
20231103103123905,"Vẻ nhí nhảnh, đáng yêu gây thương nhớ của sao bóng chuyền Mông Cổ","NHƯ YÊN,",2023-11-03T10:31:00,"Sport, Hậu Trường",https://kenh14.vn/ve-nhi-nhanh-dang-yeu-gay-thuong-nho-cua-sao-bong-chuyen-mong-co-20231103103123905.chn
20231103102509519,Sao MU chia sẻ bất ngờ trước tin đồn HLV Ten Hag bị sa thải,"PV/VOV.VN,",2023-11-03T10:25:00,"Sport, Bóng Đá",https://kenh14.vn/sao-mu-chia-se-bat-ngo-truoc-tin-don-hlv-ten-hag-bi-sa-thai-20231103102509519.chn
