id,title,author,date,categories,url
20231021222751325,Vì sao Diệu Nhi không hát trong MV chủ đề Chị Đẹp Đạp Gió Rẽ Sóng?,"Đan Thư,",2023-10-22T09:42:00,"Star, TV Show",https://kenh14.vn/vi-sao-dieu-nhi-khong-hat-trong-mv-chu-de-chi-dep-dap-gio-re-song-20231021222751325.chn
20231019180230685,"Diệp Lâm Anh nhắc lại ồn ào ly hôn ở sự kiện Chị Đẹp Đạp Gió, bị soi hành động dấy nghi vấn ""khát khao center""","Liên Hoa,",2023-10-19T23:26:57,"Star, Sao Việt",https://kenh14.vn/diep-lam-anh-nhac-lai-on-ao-ly-hon-o-su-kien-chi-dep-dap-gio-bi-soi-hanh-dong-day-nghi-van-khat-khao-center-20231019180230685.chn
20231019191634388,"Mỹ Linh bất ngờ tiết lộ các diva toàn đứng bét ở Chị Đẹp Đạp Gió, phải ""xuống nước"" với đàn em","Tường San,",2023-10-19T20:24:00,"Star, Sao Việt",https://kenh14.vn/my-linh-bat-ngo-tiet-lo-cac-diva-toan-dung-bet-o-chi-dep-dap-gio-phai-xuong-nuoc-voi-dan-em-20231019191634388.chn
20231019163327933,"Thảm đỏ Chị Đẹp Đạp Gió: Lệ Quyên và bạn trai tình tứ, Diệp Lâm Anh - Bảo Anh cùng hội mỹ nhân đọ sắc","Hạ Anh/ Ảnh: Viết Thanh/ Clip: Team sự kiện,",2023-10-19T16:34:00,"Star, Sao Việt",https://kenh14.vn/tham-do-chi-dep-dap-gio-le-quyen-va-ban-trai-tinh-tu-diep-lam-anh-bao-anh-cung-hoi-my-nhan-do-sac-20231019163327933.chn
20231021222751325,Vì sao Diệu Nhi không hát trong MV chủ đề Chị Đẹp Đạp Gió Rẽ Sóng?,"Đan Thư,",2023-10-22T09:42:00,"Star, TV Show",https://kenh14.vn/vi-sao-dieu-nhi-khong-hat-trong-mv-chu-de-chi-dep-dap-gio-re-song-20231021222751325.chn
20231020103615308,"MV Chị Đẹp Đạp Gió: Lan Ngọc ""bắn rap"" ầm ầm, fan la ó vì không thấy Diệu Nhi hát","Đan Thư,",2023-10-20T10:42:00,"Star, TV Show",https://kenh14.vn/mv-chi-dep-dap-gio-lan-ngoc-ban-rap-am-am-fan-la-o-vi-khong-thay-dieu-nhi-hat-20231020103615308.chn
20231021084108682,"Diệu Nhi đăng đàn chỉ ra 3 lần không được cất giọng hát tại Chị Đẹp Đạp Gió, chuyện gì đây?","Hạ Anh,",2023-10-21T11:01:31,"Star, Sao Việt",https://kenh14.vn/dieu-nhi-dang-dan-chi-ra-3-lan-khong-duoc-cat-giong-hat-tai-chi-dep-dap-gio-chuyen-gi-day-20231021084108682.chn
20231026144928391,Chị Đẹp Đạp Gió nhá hàng tập 1: Diệu Nhi có hành động khiến Lan Ngọc nghi ngờ,"Đan Thư,",2023-10-26T17:24:00,"Star, TV Show",https://kenh14.vn/chi-dep-dap-gio-nha-hang-tap-1-dieu-nhi-co-hanh-dong-khien-lan-ngoc-nghi-ngo-20231026144928391.chn
20231024225930119,"Phát hiện Diệu Nhi cùng nhóm với 2 chân dài ở Chị Đẹp Đạp Gió Rẽ Sóng, netizen: ""Rồi đội này ai hát?""","Đan Thư,",2023-10-25T07:01:00,"Star, TV Show",https://kenh14.vn/phat-hien-dieu-nhi-cung-nhom-voi-2-chan-dai-o-chi-dep-dap-gio-re-song-netizen-roi-doi-nay-ai-hat-20231024225930119.chn
20231016224426184,Game show 2 Ngày 1 Đêm có Trường Giang chèn quảng cáo quá lộ liễu,"Gia Lạc,",2023-10-17T00:03:00,"Star, TV Show",https://kenh14.vn/game-show-2-ngay-1-dem-co-truong-giang-chen-quang-cao-qua-lo-lieu-20231016224426184.chn
20231012184439211,"Trước Anh Tú - LyLy, đây là cặp đôi Vbiz được Trường Giang ""chèo thuyền"": Liên tiếp phủ nhận và cuối cùng về chung một nhà","Liên Hoa,",2023-10-13T00:05:00,"Star, Sao Việt",https://kenh14.vn/truoc-anh-tu-lyly-day-la-cap-doi-vbiz-duoc-truong-giang-cheo-thuyen-lien-tiep-phu-nhan-va-cuoi-cung-ve-chung-mot-nha-20231012184439211.chn
20231010205626894,"Anh Tú - LyLy làm đám cưới vào tháng 12, Trường Giang hé lộ đang đợi thiệp mời?","Liên Hoa,",2023-10-10T21:46:00,"Star, Sao Việt",https://kenh14.vn/anh-tu-lyly-lam-dam-cuoi-vao-thang-12-truong-giang-he-lo-dang-doi-thiep-moi-20231010205626894.chn
20231025124414557,"Trường Giang bị chỉ trích ""ham show mặc vợ đi đẻ một mình"", anh trai giải thích","An Nguyên/VTC News,",2023-10-25T15:04:00,"Star, Star",https://kenh14.vn/truong-giang-bi-chi-trich-ham-show-mac-vo-di-de-mot-minh-anh-trai-giai-thich-20231025124414557.chn
20231023180507835,"Hoàng Thùy Linh bị réo gọi khi Trường Giang thắc mắc: ""Tại sao người ta chê mình hát live không tốt mình lại phản ứng?""","Đan Thư,",2023-10-24T00:03:00,"Star, Star",https://kenh14.vn/hoang-thuy-linh-bi-reo-goi-khi-truong-giang-thac-mac-tai-sao-nguoi-ta-che-minh-hat-live-khong-tot-minh-lai-phan-ung-20231023180507835.chn
20231024150101532,"Lê Dương Bảo Lâm chia sẻ lý do chưa về kịp lo hậu sự mẹ vợ, nghẹn ngào nhắn nhủ đến bà xã","Liên Hoa,",2023-10-24T18:03:16,"Star, Sao Việt",https://kenh14.vn/le-duong-bao-lam-chia-se-ly-do-chua-ve-kip-lo-hau-su-me-vo-nghen-ngao-nhan-nhu-den-ba-xa-20231024150101532.chn
20231016191916776,"Thực hư chuyện Mỹ Tâm bị Lê Dương Bảo Lâm giật dây chuyền: ""Chị đại"" bất ngờ ""tố"" đàn em nói dối","Đan Thư,",2023-10-16T20:03:00,"Star, Star",https://kenh14.vn/thuc-hu-chuyen-my-tam-bi-le-duong-bao-lam-giat-day-chuyen-chi-dai-bat-ngo-to-dan-em-noi-doi-20231016191916776.chn
20231012180814973,Kiếp nạn thứ 82 của Mỹ Tâm gọi tên Lê Dương Bảo Lâm: Vừa nắm tay tình cảm đã bị giật dây chuyền,"Đan Thư,",2023-10-12T20:03:00,"Star, Star",https://kenh14.vn/kiep-nan-thu-82-cua-my-tam-goi-ten-le-duong-bao-lam-vua-nam-tay-tinh-cam-da-bi-giat-day-chuyen-20231012180814973.chn
20231024150101532,"Lê Dương Bảo Lâm chia sẻ lý do chưa về kịp lo hậu sự mẹ vợ, nghẹn ngào nhắn nhủ đến bà xã","Liên Hoa,",2023-10-24T18:03:16,"Star, Sao Việt",https://kenh14.vn/le-duong-bao-lam-chia-se-ly-do-chua-ve-kip-lo-hau-su-me-vo-nghen-ngao-nhan-nhu-den-ba-xa-20231024150101532.chn
20231018150353046,"Netizen thả ""mưa phẫn nộ"" trang cá nhân Hồng Thanh vì khen thái quá phim Trấn Thành, chính chủ phản ứng thế nào?","Liên Hoa,",2023-10-18T21:30:00,"Star, Sao Việt",https://kenh14.vn/netizen-tha-mua-phan-no-trang-ca-nhan-hong-thanh-vi-khen-thai-qua-phim-tran-thanh-chinh-chu-phan-ung-the-nao-20231018150353046.chn
20231027090519783,"Trấn Thành vướng tin nghỉ chơi với Hoa hậu Vbiz: Vắng mặt trong tiệc sinh nhật, rạn nứt sau hơn 1 thập kỷ gắn bó?","Tường San,",2023-10-27T12:04:00,"Star, Sao Việt",https://kenh14.vn/tran-thanh-vuong-tin-nghi-choi-voi-hoa-hau-vbiz-vang-mat-trong-tiec-sinh-nhat-ran-nut-sau-hon-1-thap-ky-gan-bo-20231027090519783.chn
20231025154619794,"Cú Tây Bắc (Ca Sĩ Mặt Nạ) lỡ lộ danh tính khi nhắc mối tình 35 năm, vừa được Trấn Thành mời hát nhạc phim?","Đan Thư,",2023-10-25T16:34:09,"Star, TV Show",https://kenh14.vn/cu-tay-bac-ca-si-mat-na-lo-lo-danh-tinh-khi-nhac-moi-tinh-35-nam-vua-duoc-tran-thanh-moi-hat-nhac-phim-20231025154619794.chn
20231018150353046,"Netizen thả ""mưa phẫn nộ"" trang cá nhân Hồng Thanh vì khen thái quá phim Trấn Thành, chính chủ phản ứng thế nào?","Liên Hoa,",2023-10-18T21:30:00,"Star, Sao Việt",https://kenh14.vn/netizen-tha-mua-phan-no-trang-ca-nhan-hong-thanh-vi-khen-thai-qua-phim-tran-thanh-chinh-chu-phan-ung-the-nao-20231018150353046.chn
20231023175547956,"Sao nam Vbiz sao kê thanh toán hơn 100 triệu đồng vì ồn ào ""vạ miệng"" liên quan phim của Trấn Thành","Liên Hoa,",2023-10-24T00:02:00,"Star, Sao Việt",https://kenh14.vn/sao-nam-vbiz-sao-ke-thanh-toan-hon-100-trieu-dong-vi-on-ao-va-mieng-lien-quan-phim-cua-tran-thanh-20231023175547956.chn
20231012103839505,"Trấn Thành - Tuấn Trần ""đụng mặt"" sau nghi vấn nghỉ chơi, thái độ có còn sượng trân?","Đan Thư; Clip: Team sự kiện,",2023-10-12T14:29:00,"Star, Star",https://kenh14.vn/tran-thanh-tuan-tran-dung-mat-sau-nghi-van-nghi-choi-thai-do-co-con-suong-tran-20231012103839505.chn
20231024220953614,"Decor nhà xịn xò lại chất nghệ như Thanh Thanh Huyền: Bất kỳ góc nào cũng có thể trở thành background ""sống ảo""","Hoài Thu,",2023-10-24T23:59:00,Xem Mua Luôn,https://kenh14.vn/decor-nha-xin-xo-lai-chat-nghe-nhu-thanh-thanh-huyen-bat-ky-goc-nao-cung-co-the-tro-thanh-background-song-ao-20231024220953614.chn
20230910205801099,"Phản diện đang hot: Lên phim ""báo nhà"", ngoài đời tặng bố mẹ cơ ngơi rộng 900m2, vườn đẹp như công viên","S.A,",2023-09-11T06:37:30,"Đời sống, Đời sống",https://kenh14.vn/phan-dien-dang-hot-len-phim-bao-nha-ngoai-doi-tang-bo-me-co-ngoi-rong-900m2-vuon-dep-nhu-cong-vien-20230910205801099.chn
20230825201609028,"Quỳnh Lương khoe cơ ngơi thứ 2 to như ""biệt phủ"", nói gì khi bị dân mạng chê xấu?","S.A,",2023-08-25T20:18:00,"Đời sống, House n Home",https://kenh14.vn/quynh-luong-khoe-co-ngoi-thu-2-to-nhu-biet-phu-noi-gi-khi-bi-dan-mang-che-xau-20230825201609028.chn
20231003135554474,"Vợ siêu mẫu Vĩnh Thuỵ khoe nhẫn, hoa cầm tay thuộc hàng đắt đỏ trong ngày cưới","S.A,",2023-10-03T14:05:00,"Đời sống, Đời sống",https://kenh14.vn/vo-sieu-mau-vinh-thuy-khoe-nhan-hoa-cam-tay-thuoc-hang-dat-do-trong-ngay-cuoi-20231003135554474.chn
20200326092334939,Con gái MC Quyền Linh lại gây thương nhớ khi xuất hiện trong biệt thự vườn ngập hoa trái được định giá 21 tỷ,"Jo,",2020-03-26T10:09:00,"Đời sống, Đời sống",https://kenh14.vn/con-gai-mc-quyen-linh-lai-gay-thuong-nho-khi-xuat-hien-trong-biet-thu-vuon-ngap-hoa-trai-duoc-dinh-gia-21-ty-20200326092334939.chn
20200322113829377,Khoe siêu xe thì nhiều rồi nhưng lần đầu Phan Thành đăng ảnh biệt thự xanh mát: Cái gì anh cũng có chỉ thiếu một cô vợ?,"M416,",2020-03-22T11:50:00,"Đời sống, Đời sống",https://kenh14.vn/khoe-sieu-xe-thi-nhieu-roi-nhung-lan-dau-phan-thanh-dang-anh-biet-thu-xanh-mat-cai-gi-anh-cung-co-chi-thieu-mot-co-vo-20200322113829377.chn
20200208000528039,"Chưa cần đọ xe sang với hàng hiệu, soi biệt thự và lâu đài của loạt gái xinh giàu - nứt - vách này thôi cũng thấy chóng mặt ghê","Super J; Design: Hoàng Anh,",2020-02-12T00:03:03,"Đời sống, Đời sống",https://kenh14.vn/chua-can-do-xe-sang-voi-hang-hieu-soi-biet-thu-va-lau-dai-cua-loat-gai-xinh-giau-nut-vach-nay-thoi-cung-thay-chong-mat-ghe-20200208000528039.chn
20190522134101459,"Vũ của ""Về nhà đi con"": Đại gia từ trong phim đến ngoài đời, ở biệt thự 25 tỷ và là chủ chuỗi mỳ cay có hơn 100 cửa hàng","Nấm Nguyễn,",2019-05-22T13:55:00,"Đời sống, Đời sống",https://kenh14.vn/vu-cua-ve-nha-di-con-dai-gia-tu-trong-phim-den-ngoai-doi-o-biet-thu-25-ty-va-la-chu-chuoi-my-cay-co-hon-100-cua-hang-20190522134101459.chn
20200415175004393,"Sáng tạo của các shop hoa “sống chung” với Covid-19: Vừa giúp mình đứng vững vừa mang niềm vui đến tận nhà cho khách, thấy ấm lòng!","C.,",2020-04-21T10:21:00,"Đời sống, Đời sống",https://kenh14.vn/sang-tao-cua-cac-shop-hoa-song-chung-voi-covid-19-vua-giup-minh-dung-vung-vua-mang-niem-vui-den-tan-nha-cho-khach-thay-am-long-20200415175004393.chn
20231014162457073,"Bỏ qua thị phi, người đẹp Sóc Trăng sống viên mãn được chồng tặng xe sang, tậu biệt thự","Hải My,",2023-10-14T16:27:34,"Đời sống, Đời sống",https://kenh14.vn/bo-qua-thi-phi-nguoi-dep-soc-trang-song-vien-man-duoc-chong-tang-xe-sang-tau-biet-thu-20231014162457073.chn
20231010093901703,"Couple chênh 17 tuổi đăng ký kết hôn sau bốn tháng quen nhau, giờ ""tấu hài"" mỗi ngày trong biệt thự 23 tỷ","Hải My,",2023-10-10T12:01:00,"Đời sống, Đời sống",https://kenh14.vn/couple-chenh-17-tuoi-dang-ky-ket-hon-sau-bon-thang-quen-nhau-gio-tau-hai-moi-ngay-trong-biet-thu-23-ty-20231010093901703.chn
20231007181532488,"Thế chấp nhà 1 tỷ cho chồng làm ăn, vợ ôm hận khi biết danh tính người “startup” cùng chồng","Nguyễn Quỳnh Trang,",2023-10-07T19:11:03,"Đời sống, Đời sống",https://kenh14.vn/the-chap-nha-1-ty-cho-chong-lam-an-vo-om-han-khi-biet-danh-tinh-nguoi-startup-cung-chong-20231007181532488.chn
20230725214524187,"Vừa cưới sau 8 năm hẹn hò thì phát hiện chồng ngoại tình, vợ quyết ly hôn và thay đổi ngoại hình","Hương Trà,",2023-07-25T21:58:00,"Đời sống, Đời sống",https://kenh14.vn/vua-cuoi-sau-8-nam-hen-ho-thi-phat-hien-chong-ngoai-tinh-vo-quyet-ly-hon-va-thay-doi-ngoai-hinh-20230725214524187.chn
20230720074652041,Nghiên cứu chỉ ra một sự thật bất ngờ về chuyện ngoại tình,"AMT,",2023-07-20T09:02:00,"Đời sống, Đời sống",https://kenh14.vn/nghien-cuu-chi-ra-mot-su-that-bat-ngo-ve-chuyen-ngoai-tinh-20230720074652041.chn
20230804155034412,"Khí chất của người phụ nữ không toát ra từ ngoại hình, mà là 1 THỨ cần phải tu dưỡng mỗi ngày","PV,",2023-08-04T15:52:00,"Đời sống, Đời sống",https://kenh14.vn/khi-chat-cua-nguoi-phu-nu-khong-toat-ra-tu-ngoai-hinh-ma-la-1-thu-can-phai-tu-duong-moi-ngay-20230804155034412.chn
20230819103430957,Quan sát người giàu đa số có chung 1 ĐIỂM: Gói gọn trong 2 từ nhưng có khi mất cả đời để học,"Ứng Hà Chi,",2023-08-19T13:33:00,"Đời sống, Đời sống",https://kenh14.vn/quan-sat-nguoi-giau-da-so-co-chung-1-diem-goi-gon-trong-2-tu-nhung-co-khi-mat-ca-doi-de-hoc-20230819103430957.chn
20230819072045707,"Cuộc sống hôn nhân hài hước của cặp đôi ""tí hon""","Nguyễn Quỳnh Trang,",2023-08-19T12:00:00,"Đời sống, Đời sống",https://kenh14.vn/cuoc-song-hon-nhan-hai-huoc-cua-cap-doi-ti-hon-20230819072045707.chn
20230819103739419,"Bùi Tường Vân ""gà chiến"" của Thanh Hằng ở The New Mentor: Hoa khôi sở hữu ngoại hình hệt ""búp bê sống""","Hải My,",2023-08-19T10:38:00,"Đời sống, Đời sống",https://kenh14.vn/bui-tuong-van-ga-chien-cua-thanh-hang-o-the-new-mentor-hoa-khoi-so-huu-ngoai-hinh-het-bup-be-song-20230819103739419.chn
20230811092915076,Thiếu gia Trà Vinh phản hồi gì về thông tin trục trặc tình cảm với Quỳnh Lương?,"Hải My,",2023-08-11T09:28:00,"Đời sống, Đời sống",https://kenh14.vn/thieu-gia-tra-vinh-phan-hoi-gi-ve-thong-tin-truc-trac-tinh-cam-voi-quynh-luong-20230811092915076.chn
20230810180652291,"Đến thăm nhà bạn trai, cô gái ngậm ngùi quyết định chia tay khi vô tình nghe được câu nói của ""mẹ chồng tương lai""","Trung Hạ,",2023-08-11T09:07:00,"Đời sống, Đời sống",https://kenh14.vn/den-tham-nha-ban-trai-co-gai-ngam-ngui-quyet-dinh-chia-tay-khi-vo-tinh-nghe-duoc-cau-noi-cua-me-chong-tuong-lai-20230810180652291.chn
20230811080918119,"Vì sao ""thuyền"" Thuỳ Tiên - Quang Linh Vlogs khó thành?","SA,",2023-08-11T08:10:00,"Đời sống, Đời sống",https://kenh14.vn/vi-sao-thuyen-thuy-tien-quang-linh-vlogs-kho-thanh-20230811080918119.chn
20230601102914529,"Chồng ngoại tình 10 năm, mua chung cư cao cấp cho nhân tình ở nhưng vợ không ly hôn","S.A,",2023-06-01T10:30:00,"Đời sống, Đời sống",https://kenh14.vn/chong-ngoai-tinh-10-nam-mua-chung-cu-cao-cap-cho-nhan-tinh-o-nhung-vo-khong-ly-hon-20230601102914529.chn
20221027080221267,Halloween là cơ hội thợ chụp ảnh kiếm 2-3 triệu/ngày: Có dễ lấy tiền của khách?,"Nguyễn Quỳnh Trang - Thiết kế: Thủy Tiên,",2022-10-27T09:07:00,"Đời sống, Đời sống",https://kenh14.vn/halloween-la-co-hoi-tho-chup-anh-kiem-2-3-trieu-ngay-co-de-lay-tien-cua-khach-20221027080221267.chn
20230705154852252,"Cô dâu ""quay xe"" đòi hủy hôn vì chú rể hôn gió bạn thân ngay tại đám cưới?","Ngọc Anh,",2023-07-05T15:51:00,"Đời sống, Đời sống",https://kenh14.vn/co-dau-quay-xe-doi-huy-hon-thi-chu-re-hon-gio-ban-than-ngay-tai-dam-cuoi-20230705154852252.chn
20230831202645012,"Cuộc tình kết thúc không một lời ""thông báo"" và sự thật đằng sau sự im lặng của đàn ông","AMT,",2023-09-01T12:54:39,"Đời sống, Đời sống",https://kenh14.vn/cuoc-tinh-ket-thuc-khong-mot-loi-thong-bao-va-su-that-dang-sau-su-im-lang-cua-dan-ong-20230831202645012.chn
20230815112323094,Chàng trai 25 tuổi bỏ nghề Y ra đảo Phú Quý học đánh cá và sống tiết kiệm mỗi ngày,"Nguyễn Quỳnh Trang - Thiết kế: Thành Đạt - Ảnh NVCC,",2023-08-15T13:18:00,"Đời sống, Nhân Vật",https://kenh14.vn/chang-trai-25-tuoi-bo-nghe-y-ra-dao-phu-quy-hoc-danh-ca-va-song-tiet-kiem-moi-ngay-20230815112323094.chn
20230815104621326,Người phụ nữ thay đổi bất ngờ sau 4 năm khủng hoảng ly hôn,"Ngọc Anh,",2023-08-15T11:26:32,"Đời sống, Đời sống",https://kenh14.vn/nguoi-phu-nu-thay-doi-bat-ngo-sau-4-nam-khung-hoang-ly-hon-20230815104621326.chn
20230815071738265,"Chàng trai châu Phi ăn 4 quả trứng vịt lộn, phát biểu hài hước khi lần đầu ngồi tàu điện trên cao","Thủy Tiên,",2023-08-15T08:22:30,"Đời sống, Đời sống",https://kenh14.vn/chang-trai-chau-phi-an-4-qua-trung-vit-lon-phat-bieu-hai-huoc-khi-lan-dau-ngoi-tau-dien-tren-cao-20230815071738265.chn
20230820125428243,"3 TÂM LÝ giúp đổi vận, cuộc sống từ nghèo khó bỗng hóa giàu sang, làm việc gì cũng đạt thành tựu","Ứng Hà Chi,",2023-08-20T22:14:18,"Đời sống, Đời sống",https://kenh14.vn/3-tam-ly-giup-doi-van-cuoc-song-tu-ngheo-kho-bong-hoa-giau-sang-lam-viec-gi-cung-dat-thanh-tuu-20230820125428243.chn
20230720120533065,"Ở nơi làm việc, người thường nói: “Bạn hiểu không”, người EQ cao nói vài câu làm đối phương không thể bắt bẻ","Huyền Giang,",2023-07-20T13:14:54,"Đời sống, Đời sống",https://kenh14.vn/o-noi-lam-viec-nguoi-thuong-noi-ban-hieu-khong-nguoi-eq-cao-noi-vai-cau-lam-doi-phuong-khong-the-bat-be-20230720120533065.chn
20231009170911376,"Thiếu 3 “tài sản”, người giàu đến mấy cũng khó sống yên ổn, ai sở hữu cần trân trọng, đặt lên hàng đầu","Huyền Giang,",2023-10-09T23:28:03,"Đời sống, Đời sống",https://kenh14.vn/thieu-3-tai-san-nguoi-giau-den-may-cung-kho-song-yen-on-ai-so-huu-can-tran-trong-dat-len-hang-dau-20231009170911376.chn
20230618173553262,Cuộc sống hiện tại của diễn viên sinh con năm 18 tuổi,"S.A,",2023-06-18T19:05:00,"Đời sống, Đời sống",https://kenh14.vn/cuoc-song-hien-tai-cua-dien-vien-sinh-con-nam-18-tuoi-20230618173553262.chn
20230618133848748,Độc lạ cổng cưới bằng vải thiều của cô dâu Lục Ngạn,"Lâm Thùy Dương,",2023-06-18T14:36:41,"Đời sống, Đời sống",https://kenh14.vn/doc-la-cong-cuoi-bang-vai-thieu-cua-co-dau-luc-ngan-20230618133848748.chn
20230618090437339,"Trồng khoai lang, rau dền, mồng tơi tại Mỹ: Ra vườn cả chục lần mỗi ngày vì ngắm thôi cũng vui","Huyền Trang,",2023-06-18T11:00:00,"Đời sống, Đời sống",https://kenh14.vn/trong-khoai-lang-rau-den-mong-toi-tai-my-ra-vuon-ca-chuc-lan-moi-ngay-vi-ngam-thoi-cung-vui-20230618090437339.chn
20230618074327004,"Bố, người đầy khuyết điểm trong mắt mẹ nhưng 10 điểm trong mắt tôi","Huyền Trang - Tranh: Beatrice Blue,",2023-06-18T08:45:00,"Đời sống, Đời sống",https://kenh14.vn/bo-nguoi-day-khuyet-diem-trong-mat-me-nhung-10-diem-trong-mat-toi-20230618074327004.chn
20231030073201515,"Hôn nhân của ái nữ trùm sòng bài Macau Hà Siêu Liên và Đậu Kiêu: 2 tháng trời không gặp, từ chối nắm tay tại sự kiện","S.A,",2023-10-30T07:32:29,"Đời sống, Đời sống",https://kenh14.vn/hon-nhan-cua-ai-nu-trum-song-bai-macau-ha-sieu-lien-va-dau-kieu-2-thang-troi-khong-gap-tu-choi-nam-tay-tai-su-kien-20231030073201515.chn
20231029194701315,"Chuyện tình nam MC làm host Chị Đẹp Đạp Gió: Từng đổ vỡ hôn nhân, đi bước nữa với vợ kém 14 tuổi","Hải My,",2023-10-29T21:00:00,"Đời sống, Đời sống",https://kenh14.vn/chuyen-tinh-nam-mc-lam-host-chi-dep-dap-gio-tung-do-vo-hon-nhan-di-buoc-nua-voi-vo-kem-14-tuoi-20231029194701315.chn
20231030120202921,"Cam thường check diện mạo khác lạ của 2 mỹ nhân chuyển giới được gọi là “búp bê sống”: Do tăng cân và ""dao kéo""?","S.A,",2023-10-30T12:02:18,"Đời sống, Đời sống",https://kenh14.vn/cam-thuong-check-dien-mao-khac-la-cua-2-my-nhan-chuyen-gioi-duoc-goi-la-bup-be-song-do-tang-can-va-dao-keo-20231030120202921.chn
20231030104102523,"Giữa tin đồn sắp cưới, Sơn Tùng lộ diện tươi rói bên hội bạn 1 thập kỷ và còn có động thái đặc biệt","Hạ Anh,",2023-10-30T11:33:00,"Star, Sao Việt",https://kenh14.vn/giua-tin-don-sap-cuoi-son-tung-lo-dien-tuoi-roi-ben-hoi-ban-1-thap-ky-va-con-co-dong-thai-dac-biet-20231030104102523.chn
20231025100807907,Britney Spears kể về lần đầu năm 14 tuổi,"Tú Oanh,",2023-10-25T10:44:00,"Star, Star",https://kenh14.vn/britney-spears-ke-ve-lan-dau-nam-14-tuoi-20231025100807907.chn
20231021154600755,Tình tiết mới vụ Britney Spears ngoại tình,"Tú Oanh,",2023-10-21T17:33:00,"Star, Star",https://kenh14.vn/tinh-tiet-moi-vu-britney-spears-ngoai-tinh-20231021154600755.chn
20231020211339089,"Tố Justin Timberlake lừa dối nhưng Britney Spears cũng từng ""cắm sừng"" bạn trai","Minh Hồng,",2023-10-21T00:03:51,"Star, Star",https://kenh14.vn/to-justin-timberlake-lua-doi-nhung-britney-spears-cung-tung-cam-sung-ban-trai-20231020211339089.chn
20231025100807907,Britney Spears kể về lần đầu năm 14 tuổi,"Tú Oanh,",2023-10-25T10:44:00,"Star, Star",https://kenh14.vn/britney-spears-ke-ve-lan-dau-nam-14-tuoi-20231025100807907.chn
20231020100231328,Tình trường hỗn loạn của Britney Spears trước khi thừa nhận ngoại tình,"Tú Oanh,",2023-10-20T13:04:00,"Star, Star",https://kenh14.vn/tinh-truong-hon-loan-cua-britney-spears-truoc-khi-thua-nhan-ngoai-tinh-20231020100231328.chn
20231004171759543,"Gặp Phương Lan - Phan Đạt: ""Khi Đạt quyết định mua nhà, tôi nghĩ đó là lời cầu hôn âm thầm nhưng chất lượng""","Ngọc Thuỳ/ Ảnh, clip: Lương Khải/ Thiết kế: Hoàng Sơn,",2023-10-05T00:03:00,"Star, Sao Việt",https://kenh14.vn/gap-phuong-lan-phan-dat-khi-dat-quyet-dinh-mua-nha-toi-nghi-do-la-loi-cau-hon-am-tham-nhung-chat-luong-20231004171759543.chn
20230518105724905,Diễn viên Nhà Bà Nữ cưới vào tháng 11 sau 5 năm yêu,"Hạ Anh,",2023-05-18T11:00:00,"Star, Sao Việt",https://kenh14.vn/dien-vien-nha-ba-nu-cuoi-vao-thang-11-sau-5-nam-yeu-20230518105724905.chn
20231014162139034,"Thùy Tiên lại vắng mặt tại Miss Grand hậu ồn ào bị hủy follow, động thái khó hiểu khiến netizen dậy sóng","Liên Hoa,",2023-10-14T16:21:16,"Star, Sao Việt",https://kenh14.vn/thuy-tien-lai-vang-mat-tai-miss-grand-hau-on-ao-bi-huy-follow-dong-thai-kho-hieu-khien-netizen-day-song-20231014162139034.chn
20231010072456414,"Chuyện gì đang xảy ra với Thùy Tiên: Liên hoàn ồn ào với tổ chức Miss Grand International, mối quan hệ không thể cứu vãn?","Thế Huân,",2023-10-10T09:02:00,"Star, Sao Việt",https://kenh14.vn/chuyen-gi-dang-xay-ra-voi-thuy-tien-lien-hoan-on-ao-voi-to-chuc-miss-grand-international-moi-quan-he-khong-the-cuu-van-20231010072456414.chn
20231009134101019,"Trấn Thành vướng tranh cãi vì thái độ ""bơ"" và từ chối đứng cạnh Thùy Tiên trên thảm đỏ, Hari Won nói gì?","Hạ Anh,",2023-10-09T19:04:00,"Star, Sao Việt",https://kenh14.vn/tran-thanh-vuong-tranh-cai-vi-thai-do-bo-va-tu-choi-dung-canh-thuy-tien-tren-tham-do-hari-won-noi-gi-20231009134101019.chn
20231014202716872,"Thùy Tiên cuối cùng cũng xuất hiện tại Miss Grand: Ôm chầm bà Teresa, thân thiết bên ông Nawat như ""chưa từng có cuộc drama""","Liên Hoa,",2023-10-14T20:28:00,"Star, Sao Việt",https://kenh14.vn/thuy-tien-cuoi-cung-cung-xuat-hien-tai-miss-grand-om-cham-ba-teresa-than-thiet-ben-ong-nawat-nhu-chua-tung-co-cuoc-drama-20231014202716872.chn
20231005200426908,"Hết ông Nawat đến phó chủ tịch Miss Grand bất ngờ hủy theo dõi Thùy Tiên, dấy nghi vấn mâu thuẫn lớn với ""con gái cưng""","Liên Hoa,",2023-10-06T00:03:00,"Star, Sao Việt",https://kenh14.vn/het-ong-nawat-den-pho-chu-tich-miss-grand-bat-ngo-huy-theo-doi-thuy-tien-day-nghi-van-mau-thuan-lon-voi-con-gai-cung-20231005200426908.chn
20231006185050165,"LyLy làm rõ tin hẹn hò nam ca sĩ Trung Quốc, ""thuyền"" với Anh Tú có còn ""vững tay chèo""?","Đan Thư,",2023-10-07T00:04:00,"Star, Star",https://kenh14.vn/lyly-lam-ro-tin-hen-ho-nam-ca-si-trung-quoc-thuyen-voi-anh-tu-co-con-vung-tay-cheo-20231006185050165.chn
20231002204726543,"LyLy đăng clip xin lỗi người yêu, netizen soi ra chi tiết có liên quan Anh Tú","Đan Thư,",2023-10-03T00:03:00,"Star, Star",https://kenh14.vn/lyly-dang-clip-xin-loi-nguoi-yeu-netizen-soi-ra-chi-tiet-co-lien-quan-anh-tu-20231002204726543.chn
20230928125015163,"Orange hé lộ bị một người bạn showbiz phản bội khó chấp nhận, nói gì khi LyLy bị netizen réo gọi?","Đan Thư,",2023-09-28T16:05:00,"Star, Star",https://kenh14.vn/orange-he-lo-bi-mot-nguoi-ban-showbiz-phan-boi-kho-chap-nhan-noi-gi-khi-lyly-bi-netizen-reo-goi-20230928125015163.chn
